[
	{
		"id": 1,
		"tier": "gold",
		"name": "Research Innovations Incorporated (RII)",
		"image": "/images/sponsors/rii.png",
		"link": "https://www.researchinnovations.com/"
	},
	{
		"id": 2,
		"tier": "gold",
		"name": "Alex + Sam",
		"image": "/images/sponsors/alex-and-sam.png"
	},
	{
		"id": 3,
		"tier": "silver",
		"name": "Lockheed Martin",
		"image": "/images/sponsors/lockheed-martin.png",
		"link": "https://www.lockheedmartin.com/en-us/index.html"
	},
	{
		"id": 4,
		"tier": "silver",
		"name": "Allthenticate",
		"image": "/images/sponsors/allthenticate.png",
		"link": "https://www.allthenticate.com/",
		"className": "rounded-full bg-[#0D0EFE]"
	},
	{
		"id": 5,
		"tier": "bronze",
		"name": "Cisco",
		"image": "/images/activity-groups/cisco.svg",
		"link": "https://www.cisco.com/"
	},
	{
		"id": 6,
		"tier": "bronze",
		"name": "Tommy's Snowballs",
		"image": "/images/sponsors/tommys-snowballs.png",
		"className": "rounded-full bg-white p-4"
	}
]
